{
  "schemaVersion": 3,
  "taskId": "demo-metro-synthetic",
  "revision": 1,
  "title": "[Synthetic] Metro Procedure Demo",
  "summary": "Synthetic journey demonstrating multi-modal civic procedures, milestones, and metro lanes.",
  "jurisdiction": {
    "country": "IN",
    "state": "Maharashtra",
    "city": "Mumbai",
    "localBody": "Example Municipal Corporation"
  },
  "category": "business_and_trade",
  "keywords": ["synthetic", "demo", "metro"],
  "sources": [
    {
      "id": "s-official",
      "url": "https://www.india.gov.in/",
      "title": "National Portal of India",
      "kind": "portal",
      "retrievedOn": "2026-09-27"
    }
  ],
  "questions": [
    {
      "fact": "business.sector",
      "text": "What is your business domain?",
      "options": [
        { "value": "it_saas", "label": "Technology & Software" },
        { "value": "food_service", "label": "Food & Beverage" }
      ]
    },
    {
      "fact": "company.founders_count",
      "text": "How many founders or directors are in the firm?"
    }
  ],
  "modules": [
    {
      "moduleId": "demo-identity",
      "version": 1,
      "requirement": "mandatory",
      "activation": null,
      "reason": "Identify the applicant founders."
    },
    {
      "moduleId": "demo-incorporation",
      "version": 1,
      "requirement": "mandatory",
      "activation": null,
      "reason": "Draft charter and establish the company."
    },
    {
      "moduleId": "demo-premises",
      "version": 1,
      "requirement": "mandatory",
      "activation": null,
      "reason": "Inspect premises and connect utilities."
    },
    {
      "moduleId": "demo-food",
      "version": 1,
      "requirement": "conditional",
      "activation": {
        "fact": "business.sector",
        "op": "eq",
        "value": "food_service"
      },
      "reason": "Food preparation requires specialized health licensing."
    },
    {
      "moduleId": "demo-trade",
      "version": 1,
      "requirement": "mandatory",
      "activation": null,
      "reason": "Standard operational intimation and police clearance."
    }
  ],
  "links": [
    {
      "id": "l-id-inc",
      "fromModule": "demo-identity",
      "toModule": "demo-incorporation",
      "kind": "requires"
    },
    {
      "id": "l-inc-prem",
      "fromModule": "demo-incorporation",
      "toModule": "demo-premises",
      "kind": "requires"
    },
    {
      "id": "l-inc-food",
      "fromModule": "demo-incorporation",
      "toModule": "demo-food",
      "kind": "requires"
    },
    {
      "id": "l-prem-trade",
      "fromModule": "demo-premises",
      "toModule": "demo-trade",
      "kind": "requires"
    },
    {
      "id": "l-prem-food",
      "fromModule": "demo-premises",
      "toModule": "demo-food",
      "kind": "recommended_after",
      "note": "Premises clearance recommended prior to final health inspection."
    }
  ],
  "meta": { "origin": "curated", "updatedAt": "2026-09-27T10:00:00+05:30" }
}
